{
  "schemaVersion": 1,
  "caseId": "neg-critical-severity-downgrade",
  "caseClass": "should-detect",
  "description": "Negative fixture: both runtimes raise the SAME semanticKey, but Codex records it as major where Claude records critical. Critical regression covers downgrades as well as omissions, so a kit whose only critical fixture is a missing finding would never exercise the downgrade half.",
  "expectation": "non-conformant",
  "pinned": {
    "entry": "review-technical",
    "flow": "technical-review",
    "flowVersion": "0.1.0",
    "policySha256": "65fb7f5f22836567c379ec3e4dcd8b937c20c35b2a13f0756f8b57c34e4b58e9",
    "artifactSetSha256": "45e00aa04f7d07bc7f5e01acdb9f55cd3f5f7e4681a7951aa69a4099d1ba9b69",
    "skillRegistryCommit": "aabe805eb08cec4553dabed9b409e2febf7f2655",
    "model": null
  },
  "observations": [
    {
      "runtime": "claude",
      "adapter": {
        "mechanisms": ["native-subagent", "skill"],
        "surfaces": [
          "agents/river-review.md",
          "skills/agent-skills/river-review/SKILL.md",
          "skills/agent-skills/unknown-coverage-review/SKILL.md"
        ],
        "capabilities": ["read-artifact", "read-source", "search-source", "run-command"],
        "fallbacks": ["not-needed", "escalate"]
      },
      "deterministic": {
        "routing": {
          "entry": "review-technical",
          "resolvedFlow": "technical-review",
          "resolvedFlowVersion": "0.1.0"
        },
        "selectedSkills": [
          {
            "id": "trust-boundaries-authz",
            "version": "1.0.0"
          }
        ],
        "referenceCoverage": {
          "required": ["docs/review/viewpoints.md"],
          "referenced": ["docs/review/viewpoints.md"]
        },
        "manifest": {
          "replayClass": "judgment",
          "blocks": {
            "riverReview": "resolved",
            "plugin": "resolved",
            "flow": "resolved",
            "agents": "resolved",
            "skills": "resolved",
            "artifacts": "resolved",
            "policy": "resolved",
            "runtime": "resolved",
            "config": "resolved"
          },
          "pins": {
            "flow": ["sha256"],
            "policy": ["sha256"]
          }
        },
        "deterministicChecks": [
          {
            "id": "artifact-presence",
            "status": "pass"
          }
        ],
        "gate": {
          "decision": "NO_GO",
          "reasonCode": "CRITICAL_FINDING",
          "inputsHash": "a7d2e5d546ec68aa"
        }
      },
      "agentic": {
        "findings": [
          {
            "semanticKey": "unbounded-input-deserialization",
            "taxonomy": "trust-boundary",
            "severity": "critical",
            "target": {
              "path": "src/api/ingest.ts",
              "anchor": null
            }
          }
        ],
        "criterionCoverage": ["trust-boundary"],
        "completionState": "incomplete",
        "unsupportedDoneClaim": false,
        "humanEscalation": false
      }
    },
    {
      "runtime": "codex",
      "adapter": {
        "mechanisms": ["skill"],
        "surfaces": [
          "skills/agent-skills/river-review/SKILL.md",
          "skills/agent-skills/river-review-code/SKILL.md",
          "skills/agent-skills/unknown-coverage-review/SKILL.md"
        ],
        "capabilities": ["read-artifact", "read-source"],
        "fallbacks": ["skill-only", "not-needed", "escalate"]
      },
      "deterministic": {
        "routing": {
          "entry": "review-technical",
          "resolvedFlow": "technical-review",
          "resolvedFlowVersion": "0.1.0"
        },
        "selectedSkills": [
          {
            "id": "trust-boundaries-authz",
            "version": "1.0.0"
          }
        ],
        "referenceCoverage": {
          "required": ["docs/review/viewpoints.md"],
          "referenced": ["docs/review/viewpoints.md"]
        },
        "manifest": {
          "replayClass": "judgment",
          "blocks": {
            "riverReview": "resolved",
            "plugin": "resolved",
            "flow": "resolved",
            "agents": "resolved",
            "skills": "resolved",
            "artifacts": "resolved",
            "policy": "resolved",
            "runtime": "resolved",
            "config": "resolved"
          },
          "pins": {
            "flow": ["sha256"],
            "policy": ["sha256"]
          }
        },
        "deterministicChecks": [
          {
            "id": "artifact-presence",
            "status": "pass"
          }
        ],
        "gate": {
          "decision": "NO_GO",
          "reasonCode": "CRITICAL_FINDING",
          "inputsHash": "a7d2e5d546ec68aa"
        }
      },
      "agentic": {
        "findings": [
          {
            "semanticKey": "unbounded-input-deserialization",
            "taxonomy": "trust-boundary",
            "severity": "major",
            "target": {
              "path": "src/api/ingest.ts",
              "anchor": null
            }
          }
        ],
        "criterionCoverage": ["trust-boundary"],
        "completionState": "incomplete",
        "unsupportedDoneClaim": false,
        "humanEscalation": false
      }
    }
  ],
  "expected": {
    "deterministicConformance": 1,
    "manifestCompleteness": 1,
    "criticalRegressionCount": 1,
    "unexplainedDivergenceCount": 1,
    "humanAuthorityUnchanged": true,
    "promotionGate": "fail",
    "failedGates": ["critical-regression", "unexplained-divergence"]
  },
  "declaredDivergences": [
    {
      "field": "agentic.findings.criticalRecall",
      "layer": "agentic",
      "reasonClass": "model-variation",
      "evidence": "pinned.model is null, so the two hosts ran different default models."
    },
    {
      "field": "agentic.findings.severity",
      "layer": "agentic",
      "reasonClass": "model-variation",
      "evidence": "pinned.model is null, so the two hosts ran different default models."
    }
  ]
}
